{
  "id": "qwen2-7b-instruct-int4",
  "family": "Qwen",
  "version": "1.0.0",
  "description": "Qwen2 7B Instruct model quantized to Int4 AWQ.",
  "license": "Apache-2.0",
  "source_url": "https://huggingface.co/Qwen/Qwen2-7B-Instruct-AWQ",
  "io_schema": {
    "inputs": ["Text"],
    "outputs": ["Text"]
  },
  "memory_profile": {
    "min_ram_bytes": 8589934592,
    "min_vram_bytes": 6442450944,
    "recommended_ram_bytes": 17179869184,
    "recommended_vram_bytes": 8589934592
  },
  "files": [
    {
      "name": "model.safetensors",
      "format": "Safetensors",
      "size_bytes": 5000000000,
      "required": true
    },
    {
      "name": "config.json",
      "format": "Unknown",
      "size_bytes": 1024,
      "required": true
    }
  ],
  "parameters": {
    "context_length": 32768,
    "eos_token_id": 151645
  },
  "runtime_hints": {
    "preferred_backends": ["cuda", "metal"],
    "supports_mmap": true,
    "requires_streaming": false
  },
  "primary_dtype": "Q4"
}
